video_id,title,channel,published_at,views,likes,comments,year,league,snapshot_date,engagement_rate
Hs20ouSNFgE,RELIVE - Ice Hockey - JAPAN vs SWEDEN - Women&#39;s Gold Medal Game - Day 12 | Lausanne 2020,Olympics,2020-01-21 21:13:00+00:00,56822,629,54,2020,PWHL,2026-05-30T15:05:39.170655,0.012
ZIlZXC7DbOY,Exclusive: Indian women&#39;s Hockey team goalkeeper Savita Punia speaks to RSTV,Sansad TV,2020-03-09 10:13:31+00:00,41377,953,30,2020,PWHL,2026-05-30T15:05:39.170655,0.0238
GgtqtygzUFo,[SOUVENIRS OLYMPIQUES] Hockey féminin - Sotchi 2014,Radio-Canada Sports,2020-08-10 16:45:45+00:00,32613,227,10,2020,PWHL,2026-05-30T15:05:39.170655,0.0073
RveocfzxcFE,Exclusive: Indian Women&#39;s Hockey team ace defender Deep Grace Ekka speaks to RSTV,Sansad TV,2020-03-11 14:45:58+00:00,28934,380,21,2020,PWHL,2026-05-30T15:05:39.170655,0.0139
kSLTX9Xi_tY,RELIVE - Ice Hockey -  JAPAN vs SLOVAKIA - Women&#39;s Semifinal - Day 11 | Lausanne 2020,Olympics,2020-01-20 18:02:41+00:00,27759,182,6,2020,PWHL,2026-05-30T15:05:39.170655,0.0068
XpUawG8NlgU,USA v Netherlands | Match 5 | Women&#39;s FIH Hockey Pro League Highlights,International Hockey Federation (FIH),2020-01-27 09:23:03+00:00,27080,251,0,2020,PWHL,2026-05-30T15:05:39.170655,0.0093
gmR_cKo5awc,Former hockey players make history as first female NHL refs | Hockey Culture | NBC Sports,NBC Sports,2020-07-21 19:38:27+00:00,19373,94,41,2020,PWHL,2026-05-30T15:05:39.170655,0.007
CC6TO80vJ2Y,Celebrating Young Women in Hockey | The View,The View,2020-01-29 19:59:36+00:00,19338,260,13,2020,PWHL,2026-05-30T15:05:39.170655,0.0141
76F7q57LoTo,China v Netherlands | Match 2 | Women&#39;s FIH Hockey Pro League Highlights,International Hockey Federation (FIH),2020-01-13 13:50:13+00:00,19224,151,0,2020,PWHL,2026-05-30T15:05:39.170655,0.0079
ksvTxYzkExk,RELIVE - Ice Hockey -  SLOVAKIA vs SWITZERLAND - Women&#39;s Bronze Medal Game - Day 12 | Lausanne 2020,Olympics,2020-01-21 17:44:05+00:00,18778,187,6,2020,PWHL,2026-05-30T15:05:39.170655,0.0103
a8MVwZQ4uPA,Day in the Life of a Division I Women&#39;s Ice Hockey Student-Athlete,Quinnipiac University,2020-04-06 18:00:10+00:00,16800,238,6,2020,PWHL,2026-05-30T15:05:39.170655,0.0145
nLGYII0yxZA,(1974 To 2018) Women&#39;s Hockey World Cup Winners List ! 2022 Hockey World Cup !  A S Topic,A S Topic,2020-09-26 06:30:03+00:00,13517,185,5,2020,PWHL,2026-05-30T15:05:39.170655,0.0141
df-9Oqxns1g,VICE CAPTAIN.... PAKISTAN WOMEN&#39;S HOCKEY TEAM.....AMBREEN ARSHAD,Facts of Pakistan Women's Hockey,2020-05-04 20:02:59+00:00,13433,113,0,2020,PWHL,2026-05-30T15:05:39.170655,0.0084
hwHG5W_fOzg,BAUER | Dream Gap Tour | PWHPA,Bauer Hockey,2020-01-07 21:54:48+00:00,11491,298,0,2020,PWHL,2026-05-30T15:05:39.170655,0.0259
vVaDvBjJpt8,Women Hockey INDIA🏑🏑🇮🇳🇮🇳🇮🇳,viraj bhosale,2020-02-11 10:49:28+00:00,10312,173,3,2020,PWHL,2026-05-30T15:05:39.170655,0.0171
fIrYcWKJrtM,Corona से लड़ने के लिए Indian Women&#39;s Hockey Team ने Online Campaign के जरिए बटोरे लाखों । Covid 19,The Lallantop,2020-05-06 02:00:04+00:00,10256,442,19,2020,PWHL,2026-05-30T15:05:39.170655,0.0449
OGakIns4vVA,A Virtual Look Inside: Women&#39;s Ice Hockey,Harvard Athletics,2020-07-30 14:00:05+00:00,9175,87,2,2020,PWHL,2026-05-30T15:05:39.170655,0.0097
ZIrExzTtl9E,Exclusive: Indian women&#39;s Hockey team captain Rani Rampal speaks to RSTV,Sansad TV,2020-03-09 10:15:13+00:00,7130,188,8,2020,PWHL,2026-05-30T15:05:39.170655,0.0275
2pZ3xguN53I,"JPN vs USA Women&#39;s Ice Hockey Bronze Final, WU 2019 Krasnoyarsk #UniversitySportsClassics",FISU,2020-06-09 16:00:15+00:00,6407,0,0,2020,PWHL,2026-05-30T15:05:39.170655,0.0
ZvSmC1cXGlk,Who are The Best Female Hockey Players of ALL TIME!🚺🏑,Hockey Hub,2020-07-13 23:30:03+00:00,6138,64,13,2020,PWHL,2026-05-30T15:05:39.170655,0.0125
ydMHO-YTq7w,Julie Chu &amp; Caroline Ouellette Building A Future For Women&#39;s Hockey | Top of Her Game,SPORTSNET,2020-09-28 16:00:25+00:00,6099,69,0,2020,PWHL,2026-05-30T15:05:39.170655,0.0113
e_gU1GTCnYc,"Jessica Campbell,  hopes to bring attention to pro Women&#39;s hockey game on Battle of the Blades",CBC News Saskatchewan,2020-10-23 01:30:28+00:00,4985,34,0,2020,PWHL,2026-05-30T15:05:39.170655,0.0068
aKAp0kDsTVA,Women’s Hockey World Cup 2018 Review,International Hockey Federation (FIH),2020-04-09 20:12:31+00:00,4891,62,9,2020,PWHL,2026-05-30T15:05:39.170655,0.0145
LSlM35wZXp0,2018 Olympics | Women&#39;s Hockey Highlights,Hockey Girlz,2020-06-21 14:20:53+00:00,4370,51,3,2020,PWHL,2026-05-30T15:05:39.170655,0.0124
Wh8JEf-uqaA,Cassie Campbell-Pascall On The NHL All-Star Weekend And Women&#39;s Hockey | Tim &amp; Sid,SPORTSNET,2020-01-24 23:15:14+00:00,4363,39,24,2020,PWHL,2026-05-30T15:05:39.170655,0.0144
rx6J8R8NXF4,Tamilnadu VS Hockey Chandigarh│10th National Senior Women Hockey Championship│Kerala Olympic,Kerala Olympic,2020-02-17 11:13:32+00:00,4340,71,2,2020,PWHL,2026-05-30T15:05:39.170655,0.0168
1h__DZQJV2g,ALL-STAR | Sarah Nurse Post-Skills,Edmonton Oilers,2020-01-25 05:05:30+00:00,4235,56,11,2020,PWHL,2026-05-30T15:05:39.170655,0.0158
qbQLE09SwVg,Secret® Women’s Hockey Showcase Game 1: Team Larocque vs Team Kessel,PWHPA,2020-01-11 20:29:09+00:00,4218,39,1,2020,PWHL,2026-05-30T15:05:39.170655,0.0095
RdwY7ylZZ9Y,NHL All-Star Game / Skills Competition / Player Tracking / Women&#39;s Hockey + More! - Podcast #97,Post2Post Classic,2020-01-26 23:41:37+00:00,4169,125,65,2020,PWHL,2026-05-30T15:05:39.170655,0.0456
2sVUvPTF7xQ,GAP YEAR EPI 1 - Part-time professional hockey player,Kevin Raphael,2020-01-21 13:00:00+00:00,3714,120,7,2020,PWHL,2026-05-30T15:05:39.170655,0.0342
eVgpRhGAP8o,Laura Stacey Mic&#39;d Up,GTHL - Greater Toronto Hockey League,2020-03-06 19:30:06+00:00,3414,30,0,2020,PWHL,2026-05-30T15:05:39.170655,0.0088
3nhJOXg6Ybc,“Fake It ‘Til You Make It” Natalie Spooner | Hockey Central @Home,SPORTSNET,2020-05-16 21:00:02+00:00,2884,25,4,2020,PWHL,2026-05-30T15:05:39.170655,0.0101
woUak1jC8t8,Secret® Women’s Hockey Showcase Game 6: Team Daoust vs Team Spooner,PWHPA,2020-01-13 00:15:24+00:00,2628,43,1,2020,PWHL,2026-05-30T15:05:39.170655,0.0167
6vHmkWFXzgw,The Struggle for Freedom of Women | Carol Gill,Mehrdar Art and Production,2020-09-28 13:58:04+00:00,2304,225,98,2020,PWHL,2026-05-30T15:05:39.170655,0.1402
9n7rrYHgkFI,"Women&#39;s Professional Hockey Player&#39;s Association vs. USPHL Boston Junior Bruins NCDC - Sep 19, 2020",Women's Hockey Tribune,2020-09-20 08:30:07+00:00,2157,16,0,2020,PWHL,2026-05-30T15:05:39.170655,0.0074
wzODjnVUG9w,Episode One - The Shutdown,Former Burlington Jr Barracudas,2020-12-02 01:30:11+00:00,2079,73,5,2020,PWHL,2026-05-30T15:05:39.170655,0.0375
kBQ0XXxB8lI,"Erin Ambrose On Her Playing Career, Representing Canada &amp; Current Role With The PWHPA | Ask 31",SPORTSNET,2020-06-18 20:39:50+00:00,2024,29,2,2020,PWHL,2026-05-30T15:05:39.170655,0.0153
UqfbVkiUmg4,PWHPA Women Hockey Showcase,PWHPA,2020-03-01 02:43:52+00:00,1922,15,1,2020,PWHL,2026-05-30T15:05:39.170655,0.0083
n4jMtGtbQfU,Secret® Women’s Hockey Showcase Game 4: Team Kessel vs Team Bellamy,PWHPA,2020-01-12 16:53:55+00:00,1909,29,0,2020,PWHL,2026-05-30T15:05:39.170655,0.0152
sQYDNWtkgtI,INTRODUCING TEAM SONNET  |  PWHPA  |  2021,Sonnet Insurance,2020-11-25 13:19:42+00:00,1828,9,2,2020,PWHL,2026-05-30T15:05:39.170655,0.006
cBOJYn3umpQ,2020/21 Women&#39;s Hockey League Goals Show - Week 2,England Hockey,2020-10-01 07:20:55+00:00,1822,8,0,2020,PWHL,2026-05-30T15:05:39.170655,0.0044
9QX4Dbjvtzs,Beginner&#39;s Guide to Women&#39;s Hockey: NWHL,The Ice Garden,2020-08-12 23:30:10+00:00,1655,124,9,2020,PWHL,2026-05-30T15:05:39.170655,0.0804
JhqOZ7Vd4Lc,INSTANT ANALYSIS: NWHL Expands To Toronto,SPORTSNET,2020-04-22 23:34:19+00:00,1577,43,24,2020,PWHL,2026-05-30T15:05:39.170655,0.0425
RMQEM7ebaZ8,PWHL Playoffs (Game 4) - Kitchener Waterloo Rangers vs Cambridge Rivulettes,519 Sports Online,2020-03-07 05:02:09+00:00,1567,12,0,2020,PWHL,2026-05-30T15:05:39.170655,0.0077
peCQo0Lt8dM,PWHPA Women Hockey Showcase,PWHPA,2020-02-29 23:38:37+00:00,1528,14,0,2020,PWHL,2026-05-30T15:05:39.170655,0.0092
4tUhwk-JIjI,ISOLHAC - Session 1,WHKYHAC,2020-05-10 03:18:21+00:00,1425,27,0,2020,PWHL,2026-05-30T15:05:39.170655,0.0189
2mgYsqyxXJY,Catching Up with Caley | Manon Rhéaume,Tampa Bay Lightning,2020-09-22 15:56:39+00:00,1385,48,2,2020,PWHL,2026-05-30T15:05:39.170655,0.0361
02YWDLbRpNU,Puck Culture Episode 13: Olympic Gold Medalist Natalie Spooner joins Jackie Redmond and Stu Grimson,NHL,2020-01-29 22:57:02+00:00,1369,11,4,2020,PWHL,2026-05-30T15:05:39.170655,0.011
RE0XazZf20Q,2020/21 Women&#39;s Hockey League Goals Show - Week 1,England Hockey,2020-10-28 11:57:37+00:00,1328,10,0,2020,PWHL,2026-05-30T15:05:39.170655,0.0075
zBg0ER6QSDM,Best goal rani rampal women hockey player,mo_hockey,2020-07-23 07:22:05+00:00,1247,39,1,2020,PWHL,2026-05-30T15:05:39.170655,0.0321
QQ7jCyeBqc0,World League Analysis - NCAA Women&#39;s Ice Hockey,Pro Hockey Europe,2020-05-30 22:47:24+00:00,1241,3,0,2020,PWHL,2026-05-30T15:05:39.170655,0.0024
2q8WO3xLLhY,World League Analysis - Women&#39;s Pro Hockey,Pro Hockey Europe,2020-05-30 22:51:44+00:00,1233,3,0,2020,PWHL,2026-05-30T15:05:39.170655,0.0024
FEWmVJ9O9Mw,2020/21 Women&#39;s Hockey League Goals Show - Week 1,England Hockey,2020-09-24 15:15:25+00:00,1186,11,1,2020,PWHL,2026-05-30T15:05:39.170655,0.0101
6o5mTg_hUnw,PART ONE: Exploring systemic racism with Blake Bolden &amp; Allie Thunstrom.,Black Rosie Media,2020-06-04 00:30:09+00:00,1171,47,6,2020,PWHL,2026-05-30T15:05:39.170655,0.0453
OWooBDoJpLE,2020 Hockey East Women&#39;s Championship - Northeastern vs. UConn,Hockey East,2020-03-08 20:40:15+00:00,1159,9,0,2020,PWHL,2026-05-30T15:05:39.170655,0.0078
HecxnmC8bc0,I INTERVIEWED USA &amp; CANADA WOMENS HOCKEY PLAYERS! (Interview With Alex Cavallini/Ann-Renee Desbiens),Graviteh,2020-01-27 21:08:07+00:00,1097,77,44,2020,PWHL,2026-05-30T15:05:39.170655,0.1103
ZCBXaI8rusM,"Jayna Hefford, Sarah Nurse On Upcoming Season Of The PWHPA | Top Of Her Game",SPORTSNET,2020-10-26 16:00:06+00:00,1096,10,0,2020,PWHL,2026-05-30T15:05:39.170655,0.0091
KTfsYExH7ac,Arcadia coach Kelsey Koelzer continues breaking barriers in hockey | Hockey Culture | NBC Sports,NBC Sports,2020-09-08 15:29:57+00:00,1055,22,0,2020,PWHL,2026-05-30T15:05:39.170655,0.0209
1ldLGyZ9Mvc,2020/21 Women&#39;s Hockey League Goals Show - Week 5,England Hockey,2020-10-20 14:34:49+00:00,1046,15,2,2020,PWHL,2026-05-30T15:05:39.170655,0.0163
Ih75YnF18g4,Linköping HC-AIK 3-2 | SDHL Highlights,AIK Updates,2020-09-12 20:10:08+00:00,936,9,4,2020,PWHL,2026-05-30T15:05:39.170655,0.0139
Z_hNUt6Mvwk,Highlights: Sarah Fillier vs. St. Anselm,Princeton Athletics,2020-01-07 18:09:51+00:00,599,4,0,2020,PWHL,2026-05-30T15:05:39.170655,0.0067
9ppFFMfKE84,"Women&#39;s Hockey Playoffs Oswego vs Morrisville, March 3, 2020",WTOP10TV,2020-03-08 00:37:24+00:00,500,1,0,2020,PWHL,2026-05-30T15:05:39.170655,0.002
x90yW47OhBc,PWHL Playoffs (Game 2) - Cambridge Rivulettes vs K-W Rangers,519 Sports Online,2020-03-02 16:25:39+00:00,428,3,0,2020,PWHL,2026-05-30T15:05:39.170655,0.007
GG9ue1TfLrQ,2020 Women&#39;s Hockey Highlights: Guelph Gryphons vs Toronto Varsity Blues,GryphZONE,2020-01-06 18:30:01+00:00,372,3,0,2020,PWHL,2026-05-30T15:05:39.170655,0.0081
Q7RKGuGP29o,CAN15 Daoust 2018 Final Highlights,Jack Han,2020-06-16 20:10:16+00:00,138,1,0,2020,PWHL,2026-05-30T15:05:39.170655,0.0072
U2KI6xFjC5k,St. Louis Women&#39;s Hockey League Goalie Save Highlights,Abigail Anderson,2020-04-15 09:56:36+00:00,103,0,0,2020,PWHL,2026-05-30T15:05:39.170655,0.0
bi-UOtMiqb4,Highlights: Women&#39;s Hockey at Yale,Princeton Athletics,2020-02-01 02:21:32+00:00,80,0,0,2020,PWHL,2026-05-30T15:05:39.170655,0.0
prmmql2IsbA,"CUW Women&#39;s Hockey vs. Saint Benedict Highlights (January 3, 2020)",CUWFalcons,2020-01-04 00:34:16+00:00,73,0,0,2020,PWHL,2026-05-30T15:05:39.170655,0.0
Cp9L6v5PkDY,EWSHL Week 4 Highlights,Women's Hockey Tribune,2020-07-18 19:21:56+00:00,52,0,0,2020,PWHL,2026-05-30T15:05:39.170655,0.0
X2fslAF49HY,EWSHL Week 6 Highlights,Women's Hockey Tribune,2020-07-31 15:55:54+00:00,48,0,0,2020,PWHL,2026-05-30T15:05:39.170655,0.0
EVVHgISKm3M,WHOC Highlights v. Franklin Pierce 01-10-20,rooathletics,2020-01-10 23:00:42+00:00,29,0,0,2020,PWHL,2026-05-30T15:05:39.170655,0.0
a37OvJykqlk,John Tavares Scary Injury(GRAPHIC)  Dual feed Toronto Maple leafs at Montreal Canadiens,Kaylan francis,2021-05-21 00:17:36+00:00,5842005,17299,1247,2021,PWHL,2026-05-30T15:05:39.170655,0.0032
JIEso8-Tbfo,India stun Australia in quarter-final 🏑 | #Tokyo2020 Highlights,Olympics,2021-08-02 10:01:06+00:00,4282559,103268,4582,2021,PWHL,2026-05-30T15:05:39.170655,0.0252
R3zNkWX9QH8,The Kapil Sharma Show - The Indian Hockey Team Uncensored Footage | Indian Women &amp; Men&#39;s Hockey Team,Kapil Sharma,2021-09-09 05:30:04+00:00,1188242,37159,483,2021,PWHL,2026-05-30T15:05:39.170655,0.0317
j841ZxlXMqY,India’s first ever bronze medal match! 🏑 | #Tokyo2020 Highlights,Olympics,2021-08-06 08:03:48+00:00,1087464,15443,818,2021,PWHL,2026-05-30T15:05:39.170655,0.015
3mZ2-aEDAzc,Netherlands 🇳🇱 vs Argentina 🇦🇷 | Women&#39;s Hockey 🏑 🥇 Gold Medal Match | Tokyo Replays,Olympics,2021-08-14 11:00:02+00:00,802723,5378,243,2021,PWHL,2026-05-30T15:05:39.170655,0.007
9XdoD83iKBQ,"Women&#39;s Hockey: मेडल नहीं पर मान प्रतिष्ठा और दिल जीता, देखिए भावुक कर देने वाली यह तसवीरें",News Tak,2021-08-06 07:13:19+00:00,553524,19359,1114,2021,PWHL,2026-05-30T15:05:39.170655,0.037
464ZQLumY1w,Huge Victory! Indian Women&#39;s Hockey Team Defeats Australia in Tokyo Olympics #shorts,World Affairs by Unacademy,2021-08-02 05:50:05+00:00,326250,37738,920,2021,PWHL,2026-05-30T15:05:39.170655,0.1185
YuO42pQ2YfM,DNA EXCLUSIVE: जानिए Indian Women&#39;s Hockey Team के खिलाड़ियों का &#39;Tokyo संघर्ष&#39; | Sudhir Chaudhary,Zee News,2021-08-10 17:17:40+00:00,267476,7121,773,2021,PWHL,2026-05-30T15:05:39.170655,0.0295
oiMiPb774KU,Tokyo Olympic 2020 में जीत के बाद Indian Women Hockey team के कोच ने Shahrukh Khan को क्या जवाब दिया,The Lallantop,2021-08-02 13:15:02+00:00,216112,9908,457,2021,PWHL,2026-05-30T15:05:39.170655,0.048
cr5SYPHPoU4,Tokyo Olympics 2021 - Indian Men&#39;s and Women&#39;s Hockey Teams created history - Sports Current Affairs,StudyIQ IAS,2021-08-02 06:30:13+00:00,209689,10469,472,2021,PWHL,2026-05-30T15:05:39.170655,0.0522
F2SJlZBF0P0,Tokyo Olympics: Indian Women&#39;s Hockey Team Reach Semifinals; Beat Australia By 1-0 | Breaking News,India Today,2021-08-02 05:05:22+00:00,195786,3027,302,2021,PWHL,2026-05-30T15:05:39.170655,0.017
MMVDxMukEnc,Why SRK Thinks He is Ex-Coach of Indian Women Hockey Team? I Tripti Shrivastava | Capital TV,CAPITAL TV,2021-08-03 12:39:53+00:00,184211,13759,1775,2021,PWHL,2026-05-30T15:05:39.170655,0.0843
-EflvowxvUg,After 41 Years INDIA wins Hockey Olympic Medal | Pakistan Women&#39;s Hockey Team Reaction | Sana Amjad,Sana Amjad,2021-08-06 04:00:00+00:00,166540,6453,1224,2021,PWHL,2026-05-30T15:05:39.170655,0.0461
Bg-MKJDPtO4,Indian women’s hockey coach Sjoerd Marijne cries after win | Oneindia News,Oneindia News,2021-08-02 13:20:04+00:00,135282,3467,109,2021,PWHL,2026-05-30T15:05:39.170655,0.0264
iCCM3NXMDbo,"GROUND REPORT TOKYO 2020 : QF में जीत का डंका, WOMEN&#39;S HOCKEY ने रचा इतिहास, अब सेमीफाइनल लक्ष्य|",Sports Tak,2021-08-02 08:25:52+00:00,119087,5698,490,2021,PWHL,2026-05-30T15:05:39.170655,0.052
yPXZbzpuo1s,"Tokyo Olympics | PV Sindhu Coach, Indian Women&#39;s Hockey Coach Sjoerd Marijne Helped Indian Players",India Narrative,2021-08-02 11:34:33+00:00,112976,1630,36,2021,PWHL,2026-05-30T15:05:39.170655,0.0147
LfSpVHmslVc,Women&#39;s hockey team cries during PM Modi phone call after Olympics loss,Hindustan Times,2021-08-06 10:32:13+00:00,100398,4051,442,2021,PWHL,2026-05-30T15:05:39.170655,0.0448
-R49h-A7O3M,"Tokyo Olympics 2021: Women&#39;s Hockey में Indian Team ने रच दिया इतिहास, Australia को हराया",Aaj Tak HD,2021-08-02 05:07:43+00:00,100083,2580,195,2021,PWHL,2026-05-30T15:05:39.170655,0.0277
uqllBxH9RL4,"India women&#39;s hockey team beat Australia at Tokyo Olympics, qualify for first-ever semi | The Bridge",The Bridge,2021-08-02 05:20:41+00:00,93628,5510,77,2021,PWHL,2026-05-30T15:05:39.170655,0.0597
g6mAXnPMniI,"Tokyo Olympics 2021: Indian Women&#39;s Hockey Team के जज्बे को Britain ने किया सलाम, देखें क्या कहा?",Aaj Tak HD,2021-08-06 10:32:17+00:00,72560,1521,73,2021,PWHL,2026-05-30T15:05:39.170655,0.022
d59cEK26HUM,Hockey Player VS Figure Skater,Viral Hour,2021-03-08 21:00:07+00:00,68054,1956,30,2021,PWHL,2026-05-30T15:05:39.170655,0.0292
dwbrfJbr0Ec,India Olympic Whatsapp Status Download | Men&#39;s &amp; Women&#39;s Hockey Teams through to Semi-final #Shorts,SLAYTHREADZ,2021-08-02 20:05:54+00:00,52120,3511,10,2021,PWHL,2026-05-30T15:05:39.170655,0.0676
kqi8cqv4bVM,India vs Argentina Tokyo Olympics women’s hockey preview | NTV Sports,NTV Sports,2021-08-03 14:15:45+00:00,51696,966,40,2021,PWHL,2026-05-30T15:05:39.170655,0.0195
RviJNESDmf0,Special Story | Tokyo Olympics | Know Rani Rampal The Women&#39;s Hockey Captain,OTV,2021-08-04 00:30:02+00:00,49334,1466,68,2021,PWHL,2026-05-30T15:05:39.170655,0.0311
W5L3Dn51OGI,"AAJ TAK SHOW: पूरे देश का दिल तोड़ गई Women&#39;s Hockey Team की हार, Bajrang से Medal की बढ़ी उम्मीद |",Sports Tak,2021-08-06 06:35:11+00:00,49014,1884,178,2021,PWHL,2026-05-30T15:05:39.170655,0.0421
ovl3b_qCEt0,India Women vs Aus Women Hockey Quarter final match Full highlights | ind vs aus women&#39;s Tokyo 2020|,The Engineer Tech96,2021-08-02 04:54:19+00:00,48818,0,0,2021,PWHL,2026-05-30T15:05:39.170655,0.0
DloD-LpCL_A,🇮🇳&quot;Chak de India&quot;|| indian women hockey team winning moment against australia|| Tokyo olympics||❤️,Prakash S. Tadiyal ,2021-08-02 10:34:18+00:00,48394,184,1,2021,PWHL,2026-05-30T15:05:39.170655,0.0038
fVc-Nbj6OyY,Chak De India| woman&#39;s hockey|whatsapp status |status,AR Tech,2021-08-02 10:16:42+00:00,46221,278,4,2021,PWHL,2026-05-30T15:05:39.170655,0.0061
LZ5mQ9PfeCE,&quot;Time For Chak De! India Part 2&quot;: Women&#39;s Hockey Coach After Tokyo Show,NDTV,2021-08-06 09:12:38+00:00,42985,1571,52,2021,PWHL,2026-05-30T15:05:39.170655,0.0378
5Ln0wmaf2XY,IND vs GBR | 3-4 | Olympic Women&#39;s Hockey Bronze Match | HIghlights | Tokyo Olympics 2020,Sportzworkz,2021-08-03 12:30:01+00:00,42836,273,22,2021,PWHL,2026-05-30T15:05:39.170655,0.0069
RyeEiH5FXW0,Indian Women&#39;s Hockey Team ने Australia को ऐसे पीटा कि बन गया इतिहास Tokyo Olympics । Team India,The Lallantop,2021-08-02 09:30:05+00:00,42677,1186,78,2021,PWHL,2026-05-30T15:05:39.170655,0.0296
ll2ZyqWczLM,Khabar Jabar | Know Players Of Indian Women&#39;s Hockey Team In Olympics,OTV,2021-08-03 18:01:42+00:00,41867,1076,43,2021,PWHL,2026-05-30T15:05:39.170655,0.0267
J9zVDgMDtDY,Coach Marjine Says Bye To India Women Hockey,N1 Media Consultancy Private Limited,2021-08-06 12:19:44+00:00,41277,680,32,2021,PWHL,2026-05-30T15:05:39.170655,0.0172
YcHxfMQSmgY,Women Hockey Losers Final | Women&#39;s Hockey Loss | Women Hockey Olympics 2020 | Indian Women Hockey,Turant News,2021-08-06 11:04:45+00:00,39928,494,23,2021,PWHL,2026-05-30T15:05:39.170655,0.0129
rNLJrwyv3bc,Overtime goal lifts Wisconsin to Women&#39;s Frozen Four title,NCAA Championships,2021-03-21 03:43:40+00:00,39284,315,25,2021,PWHL,2026-05-30T15:05:39.170655,0.0087
MRrvqiQhcJI,Marie-Philip Poulin - &quot;The Crosby Women&quot; ᴴᴰ,Sports Montage,2021-09-01 18:00:14+00:00,14814,154,0,2021,PWHL,2026-05-30T15:05:39.170655,0.0104
60_GwXRNMcs,Top 7 Indian Women Hockey Players of All Time,Biography Lane,2021-08-06 15:11:35+00:00,14514,162,7,2021,PWHL,2026-05-30T15:05:39.170655,0.0116
eR-w-DoWHz4,Women&#39;s Hockey Olympics 2021 -  Point Table  &amp; Quarter Final Schedule,KAVISH WORLD,2021-07-31 14:46:05+00:00,13920,110,10,2021,PWHL,2026-05-30T15:05:39.170655,0.0086
cRQhWny8K3I,Play On! Podcast - Episode 2 - Jamie Lee Rattray,Play On! Canada,2021-06-24 16:19:27+00:00,13722,0,0,2021,PWHL,2026-05-30T15:05:39.170655,0.0
6jrAgLssOO8,"After Tokyo Olympics, what has changed for women hockey? Answers team player Monika Malik",ABP NEWS,2021-08-11 11:44:01+00:00,11778,292,25,2021,PWHL,2026-05-30T15:05:39.170655,0.0269
ahHGh1lWojg,Discussing The Comments Made By Bettman And Daly Surrounding The Blackhawks &amp; Womens Hockey,sdpn,2021-07-01 20:00:01+00:00,10528,215,26,2021,PWHL,2026-05-30T15:05:39.170655,0.0229
-A8R2_2ioXU,GAME DAY IN THE WOMEN&#39;S WORLDS BUBBLE,TSN,2021-08-20 22:07:54+00:00,8800,284,26,2021,PWHL,2026-05-30T15:05:39.170655,0.0352
-qZxAYaaGv0,Erika Nardini and the NWHL Explained,KFC Radio,2021-01-27 16:23:14+00:00,8590,244,41,2021,PWHL,2026-05-30T15:05:39.170655,0.0332
2hdxt8EzXqA,The movement for a pro women’s soccer league in Canada,CBC News: The National,2021-08-07 02:00:10+00:00,6693,96,0,2021,PWHL,2026-05-30T15:05:39.170655,0.0143
6W0ZVaXskdA,Sport Chek | The Joy of Hockey: Sarah Nurse Extended Cut,Sport Chek,2021-03-08 18:11:10+00:00,6012,74,6,2021,PWHL,2026-05-30T15:05:39.170655,0.0133
5CVgQ3glw6M,Exclusive Interview With Indian Women&#39;s Hockey Team Vice Captain Deepgrace Ekka || KalingaTV,Kalinga TV,2021-08-10 09:09:02+00:00,5126,149,5,2021,PWHL,2026-05-30T15:05:39.170655,0.03
fvwmBzhH2Sw,UW Women&#39;s Hockey - 2021 NATIONAL CHAMPIONS,Britta Curl-Salemme,2021-07-01 15:35:37+00:00,5040,54,3,2021,PWHL,2026-05-30T15:05:39.170655,0.0113
UKZA8Uo7r9M,"Fillier decks Decker, then Decker decks Fillier - 2021 Women&#39;s World Championship",Apocalypse Plough,2021-10-05 14:07:02+00:00,4896,0,8,2021,PWHL,2026-05-30T15:05:39.170655,0.0016
zpDud8Jb_zc,05/30 | Nurse 2-1 Goal | SDGT CAL,PWHPA,2021-05-30 23:43:43+00:00,4670,22,7,2021,PWHL,2026-05-30T15:05:39.170655,0.0062
WIsBk3IYuaM,Gopher Women&#39;s Hockeys&#39; Taylor Heise Mic&#39;d Up,Minnesota Gophers,2021-11-30 15:09:03+00:00,4407,67,1,2021,PWHL,2026-05-30T15:05:39.170655,0.0154
5GLP3UbZDOE,"Team Sonnet vs Team Bauer | May 24, 2021",PWHPA,2021-05-25 01:12:36+00:00,4140,69,3,2021,PWHL,2026-05-30T15:05:39.170655,0.0174
cNEtEILcmDI,Jennifer Botterill: The push for women in sports broadcasting and a pro women’s hockey league,CBC News: The National,2021-06-28 02:50:18+00:00,4129,38,0,2021,PWHL,2026-05-30T15:05:39.170655,0.0092
Rl7SKKmgyQE,Carey Price Tribute Playoffs 2021 | Survey Winners,Dahan Goaltending - Goalie Hockey School,2021-06-18 03:54:33+00:00,4013,73,1,2021,PWHL,2026-05-30T15:05:39.170655,0.0184
50y5OjYwvOc,"The journey, Olympics and women&#39;s sports : Inspire #4 - Laura Stacey and Jill Saulnier | Hockey (EN)",Living Sisu,2021-03-08 12:00:02+00:00,3926,52,0,2021,PWHL,2026-05-30T15:05:39.170655,0.0132
AzCfOqqhV5E,"Team Bauer vs Team Scotiabank | May 25, 2021",PWHPA,2021-05-25 23:35:58+00:00,3410,50,1,2021,PWHL,2026-05-30T15:05:39.170655,0.015
aVuj8nogasc,PROFESSIONAL WOMEN&#39;S HOCKEY BUBBLE VLOG,hanna bunton,2021-06-10 21:57:19+00:00,3404,57,0,2021,PWHL,2026-05-30T15:05:39.170655,0.0167
sgI_2FGsutk,TKSS 3: Archana Puran Singhh CONFIRMS The Indian Women &amp; Men Hockey Team As  Upcoming Week Guests,Telly Reporter,2021-08-25 20:00:10+00:00,3353,27,4,2021,PWHL,2026-05-30T15:05:39.170655,0.0092
L4ivaFPrCPc,Empty stands at Women&#39;s World Hockey Championship,660 NEWS,2021-08-28 01:50:02+00:00,3211,3,4,2021,PWHL,2026-05-30T15:05:39.170655,0.0022
Os1hC_GaKys,Marie-Philip Poulin Overtime Winner 🚨 vs Team USA,Hockey Empire ,2021-12-18 11:40:57+00:00,3201,16,3,2021,PWHL,2026-05-30T15:05:39.170655,0.0059
VRye3u5a8tE,Stick In The Ground,PWHPA,2021-02-26 15:00:25+00:00,3169,56,1,2021,PWHL,2026-05-30T15:05:39.170655,0.018
FOlKVWp0HA4,Humans of Hockey: Amanda Kessel,New York Rangers,2021-04-30 19:29:35+00:00,2710,54,7,2021,PWHL,2026-05-30T15:05:39.170655,0.0225
2UoNiGMkSmo,PWHPA MIC&#39;D UP! Professional Women&#39;s Hockey at Madison Square Garden,Bauer Hockey,2021-03-08 15:43:26+00:00,2517,49,6,2021,PWHL,2026-05-30T15:05:39.170655,0.0219
qYX1EGQHh6U,Blayre Turnbull Injury - Blair Turnbull Hockey Team | What Happened to Blayre Turnbull,no account,2021-09-01 16:14:41+00:00,2465,1,2,2021,PWHL,2026-05-30T15:05:39.170655,0.0012
9T_-YwmaTLA,Boston University Women’s Hockey Vlog Featuring Lacey Martin,College Hockey Talk,2021-11-17 07:21:59+00:00,2423,27,0,2021,PWHL,2026-05-30T15:05:39.170655,0.0111
HPmXTzV2uxM,Hon. MoS Shri Nisith Pramanik on #KheloIndia Women&#39;s Hockey League (U21),Sports Authority of India,2021-12-16 13:30:07+00:00,2232,38,1,2021,PWHL,2026-05-30T15:05:39.170655,0.0175
DCphcEhOEN8,"Team Sonnet vs Team Scotiabank | May 26, 2021",PWHPA,2021-05-26 23:33:35+00:00,2138,37,2,2021,PWHL,2026-05-30T15:05:39.170655,0.0182
qQrpuzTv_kI,PWHPA&#39;s Secret Dream Gap Tour Heads Up North To Calgary This Week,SPORTSNET,2021-05-22 21:17:38+00:00,2100,42,0,2021,PWHL,2026-05-30T15:05:39.170655,0.02
e1qa-25ZvuY,05/30 | Marie-Philip Poulin Post Game Press Conference | SDGT CAL,PWHPA,2021-05-31 22:33:42+00:00,2015,40,0,2021,PWHL,2026-05-30T15:05:39.170655,0.0199
BVaFcWUnxJk,Erin Ambrose Using PWHPA Platform To Speak Out On Mental Health Issues,SPORTSNET,2021-05-30 01:08:04+00:00,1973,41,0,2021,PWHL,2026-05-30T15:05:39.170655,0.0208
kl2eREbgRIM,PWHPA&#39;s Secret Dream Gap Tour Heads To St. Louis,SPORTSNET,2021-05-15 14:00:12+00:00,1759,27,0,2021,PWHL,2026-05-30T15:05:39.170655,0.0153
-kuQ1du39t0,HIGHLIGHTS | Buffalo Beauts vs Toronto Six (3-4) | PHF,The Toronto Six,2021-11-08 18:00:00+00:00,953,26,2,2021,PWHL,2026-05-30T15:05:39.170655,0.0294
