video_id,title,channel,published_at,views,likes,comments,year,league,snapshot_date,engagement_rate
SLskVYo7zVk,Full Game Highlights | Sue Bird TAKES OVER In 4th Q As Storm Advance To Finals,WNBA,2018-09-05 18:48:05+00:00,234309,2176,118,2018,WNBA,2026-05-30T15:05:39.170655,0.0098
2IaIVPD09QA,Best of Sue Bird&#39;s 2018 Season,WNBA,2018-12-06 17:00:00+00:00,212939,2356,621,2018,WNBA,2026-05-30T15:05:39.170655,0.014
tBH46hhUVLg,Top 8th Grader In Iowa Caitlin Clark Mixtape @ Simply The Best!,Courtside,2018-02-20 21:11:17+00:00,163115,1115,164,2018,WNBA,2026-05-30T15:05:39.170655,0.0078
tY9JJN2gcXo,Best of Maya Moore&#39;s 2018 Season,WNBA,2018-10-25 21:37:30+00:00,152930,1429,198,2018,WNBA,2026-05-30T15:05:39.170655,0.0106
Ot2hAg27gwk,Sue Bird&#39;s Career All-Star Highlight Mix,WNBA,2018-07-27 02:02:50+00:00,98393,926,220,2018,WNBA,2026-05-30T15:05:39.170655,0.0116
fcrlM-pA-e4,Skylar Diggins-Smith 1st Round Highlights,WNBA,2018-08-22 04:18:00+00:00,49287,370,33,2018,WNBA,2026-05-30T15:05:39.170655,0.0082
beX_A7sWPK8,Best of Chiney Ogwumike&#39;s 2018 Season,WNBA,2018-11-05 15:29:57+00:00,29449,285,25,2018,WNBA,2026-05-30T15:05:39.170655,0.0105
u7l6QG10qy0,Player of the Month Highlights: Breanna Stewart,WNBA,2018-08-02 02:52:41+00:00,23642,241,21,2018,WNBA,2026-05-30T15:05:39.170655,0.0111
AVHmauxdPN4,Diana Taurasi puts on passing clinic in Mercury playoff win [Highlights] | ESPN,ESPN,2018-08-22 03:57:10+00:00,22922,361,79,2018,WNBA,2026-05-30T15:05:39.170655,0.0192
LAOoF2gyQaA,The Harshest Burns from the Roast of Justin Bieber,Comedy Central,2019-08-25 18:00:00+00:00,55122748,956178,21982,2019,WNBA,2026-05-30T15:05:39.170655,0.0177
f3CBJLAneCA,10-Year-Old HANDLES Like Kyrie Irving | Jiggy Izzy Highlights,Whistle,2019-04-09 21:00:03+00:00,4010145,28632,2352,2019,WNBA,2026-05-30T15:05:39.170655,0.0077
O_tnaaKQGz0,#1 PLAYER Caitlin Clark RESPONDS To OVERRATED Chants With 42 Points!,Courtside Films,2019-12-10 05:15:30+00:00,3168564,20801,3596,2019,WNBA,2026-05-30T15:05:39.170655,0.0077
O7PNM57g7Qw,India v Korea - Full Game - FIBA Women&#39;s Asia Cup 2019,FIBA Basketball,2019-10-09 18:30:01+00:00,330888,3837,185,2019,WNBA,2026-05-30T15:05:39.170655,0.0122
ez3jDERjyW8,Hamby Drills Miraculous Game-Winner After Clutch Steal,WNBA,2019-09-16 00:16:50+00:00,90997,794,138,2019,WNBA,2026-05-30T15:05:39.170655,0.0102
usMyzmt1eak,Kobe Bryant Interview | UConn Women&#39;s Basketball 03/02/2019,Storrs South,2019-03-03 03:42:48+00:00,78102,1242,83,2019,WNBA,2026-05-30T15:05:39.170655,0.017
648wer4PEZY,Marine Johannes Is Perfect vs. Sparks,WNBA,2019-07-20 21:36:40+00:00,72795,824,45,2019,WNBA,2026-05-30T15:05:39.170655,0.0119
29XfrWwa8Fo,Top 10 Plays of the 2019 Season,WNBA,2019-12-31 22:05:43+00:00,47109,645,208,2019,WNBA,2026-05-30T15:05:39.170655,0.0181
QL4ZDVX1_C8,"Emma Meesseman, Elena Delle Donne Combine For 47 PTS In Game 4 Of Semifinals",WNBA,2019-09-25 04:17:01+00:00,46641,390,43,2019,WNBA,2026-05-30T15:05:39.170655,0.0093
dNkHJMhM0VA,Simay Naz Öget Highlight,Tolgahan Ulaş,2019-02-24 18:58:55+00:00,38213,72,23,2019,WNBA,2026-05-30T15:05:39.170655,0.0025
6iMM5atHjaw,OVERTIME THRILLER HIGHLIGHTS // USA U19 WORLD CUP TEAM DEFEATS AUSTRALIA,USA Basketball,2019-07-29 17:00:01+00:00,28819,224,12,2019,WNBA,2026-05-30T15:05:39.170655,0.0082
mzmew29H5H4,Top 10 Plays of the Decade,WNBA,2020-01-03 17:18:23+00:00,465043,6315,34,2020,WNBA,2026-05-30T15:05:39.170655,0.0137
3tTvfJ_ths4,Paige Bueckers TOP PLAYS!! #1 Ranked Girls Hooper FOR A REASON!!,Courtside Films,2020-05-17 14:36:29+00:00,413080,4799,253,2020,WNBA,2026-05-30T15:05:39.170655,0.0122
xovh0KXlAY0,Te’a Cooper Highlight,Tt,2020-11-28 23:17:53+00:00,166056,7374,194,2020,WNBA,2026-05-30T15:05:39.170655,0.0456
052HJkhdQJE,On This Day: Dearica Hamby Hits Game Winner From 35 Feet Away,WNBA,2020-09-15 17:14:36+00:00,70276,2352,54,2020,WNBA,2026-05-30T15:05:39.170655,0.0342
OqZG6Z4IBzk,Best Of Sue Birds Assists Over The Years,WNBA,2020-10-16 18:20:28+00:00,56061,771,52,2020,WNBA,2026-05-30T15:05:39.170655,0.0147
3W7Y3gbwGKc,Women of Troy (2020): Official Trailer | HBO,HBO,2020-02-20 19:00:01+00:00,55783,531,52,2020,WNBA,2026-05-30T15:05:39.170655,0.0105
eKdGfXnb6yg,Margo Dydek | Hall of Fame Class 2019,FIBA Basketball,2020-01-14 13:04:43+00:00,44861,328,18,2020,WNBA,2026-05-30T15:05:39.170655,0.0077
6ZWJgNIIMDQ,A&#39;ja Wilson - Fantastic Footwork/Postup Powerhouse,Evin Gualberto,2020-08-06 16:06:39+00:00,18946,283,32,2020,WNBA,2026-05-30T15:05:39.170655,0.0166
MF3RnE5BP5E,Christyn Williams Junior Year Hype Video,UCTV,2020-10-07 23:29:13+00:00,16949,248,5,2020,WNBA,2026-05-30T15:05:39.170655,0.0149
R1z21P1rkaY,Best Of Arike Ogunbowale&#39;s 2020 Regular Season,WNBA,2020-09-15 13:30:03+00:00,9293,206,30,2020,WNBA,2026-05-30T15:05:39.170655,0.0254
JvY73NV2_jU,Support Women&#39;s Basketball on all Levels! 💗💯✊🏿🗣🏀🥇,🤴🏿King Fitch,2020-11-25 17:45:10+00:00,4676,21,0,2020,WNBA,2026-05-30T15:05:39.170655,0.0045
zqBgxqCOmec,Liz Cambage Completely DISRESPECTS Her Opponent’s Defense 🥶,TPGC Highlights,2021-06-06 21:37:58+00:00,7678149,112458,1606,2021,WNBA,2026-05-30T15:05:39.170655,0.0149
IIF8GSSIOTs,Caitlin Clark Gets Technical After Hitting 3 For &#39;Taunting&#39; Then Forces Turnover &amp; Hits ANOTHER 3!,Women Hooping,2021-11-16 17:00:26+00:00,2388306,0,1584,2021,WNBA,2026-05-30T15:05:39.170655,0.0007
_4H6mBs6wKw,Liz Cambage Opals Mix,Dunk Comp,2021-04-08 02:10:43+00:00,2102763,37139,0,2021,WNBA,2026-05-30T15:05:39.170655,0.0177
mk3w91rRgyM,That awkward moment when your bully is a FOOT shorter than you. 🤣 #TeaCooper #shorts #LizCambage,Women Hooping,2021-07-02 22:28:39+00:00,1538005,31922,1371,2021,WNBA,2026-05-30T15:05:39.170655,0.0216
4R-R2dUIR1o,Tall Female Basketball Players: The Tallest Girls In Sport,We Inspire Conversations,2021-04-07 09:00:01+00:00,986846,6955,424,2021,WNBA,2026-05-30T15:05:39.170655,0.0075
3FCqMU0WNgM,Steph vs Paige Bueckers,Ballislife Shorts,2021-01-30 21:06:55+00:00,897626,17035,202,2021,WNBA,2026-05-30T15:05:39.170655,0.0192
2fiGZFHw03c,"PAIGE BUECKERS MAY HAVE TORN ACL! Leaves Game IN TEARS After Hurting Knee, Helped Off Court! #UConn",Women Hooping,2021-12-05 19:36:19+00:00,391346,0,204,2021,WNBA,2026-05-30T15:05:39.170655,0.0005
5mbOzZqPynQ,What a Move By Terry Rozier! 🤯,TPGC Highlights,2021-11-23 14:39:59+00:00,352588,11578,45,2021,WNBA,2026-05-30T15:05:39.170655,0.033
PuOVSBL7-Lg,"PHOENIX MERCURY vs. CHICAGO SKY | FULL GAME HIGHLIGHTS | October 17, 2021",WNBA,2021-10-17 21:52:31+00:00,344037,4769,768,2021,WNBA,2026-05-30T15:05:39.170655,0.0161
DAqmXAKjT2k,"USA WOMEN&#39;S NATIONAL TEAM vs. BASKETBALL AUSTRALIA | FULL GAME HIGHLIGHTS | July 16, 2021",WNBA,2021-07-16 20:46:54+00:00,301681,2135,263,2021,WNBA,2026-05-30T15:05:39.170655,0.0079
-20EmbHmh-U,GIRLS BASKETBALL TOP 10 ANKLE BREAKERS OF ALL-TIME!!,Courtside Films,2021-11-26 23:00:00+00:00,295613,3960,156,2021,WNBA,2026-05-30T15:05:39.170655,0.0139
6sQCeX0agrk,🥇Is Paige Bueckers (UCONN) the BEST player in Basketball⁉️,Hoop Dreams Basketball 🏀🧠,2021-03-27 20:35:23+00:00,206442,7150,328,2021,WNBA,2026-05-30T15:05:39.170655,0.0362
q11XrA7k3hM,Best Handles of 2021 Season,WNBA,2021-11-04 19:22:12+00:00,101403,1209,139,2021,WNBA,2026-05-30T15:05:39.170655,0.0133
BtBl9SkIyUg,Candace Parker is UNGUARDABLE 😤 Pt. 2,TPGC Highlights,2021-10-07 02:57:00+00:00,75323,1087,47,2021,WNBA,2026-05-30T15:05:39.170655,0.0151
q0QH76GYvWs,Te&#39;a Cooper Has CAREER HIGH 26 Points For The L.A. Sparks vs Washington Mystics,Women Hooping,2021-06-25 16:30:10+00:00,66816,735,41,2021,WNBA,2026-05-30T15:05:39.170655,0.0116
7m6szgO9_uo,Leylah Fernandez makes history at the US Open by upsetting Naomi Osaka 🎾 | #shorts,ESPN,2021-09-04 03:16:36+00:00,65302,1015,158,2021,WNBA,2026-05-30T15:05:39.170655,0.018
wiKybWSyeME,Wilt Chamberlain Highlights in 4K 😨 *RARE*,TPGC Highlights,2021-10-17 14:12:27+00:00,33165,1502,90,2021,WNBA,2026-05-30T15:05:39.170655,0.048
jHa-_C19BB4,8 EJECTED In BRAWL Caused By Hair Pull Between TCU Horned Frogs &amp; George Washington Colonials!,Women Hooping,2022-12-07 23:35:00+00:00,6234173,0,6470,2022,WNBA,2026-05-30T15:05:39.170655,0.001
mdTf772vXbw,Best Girls Game Ever⁉️😳 Jada Williams GOES AT IT vs Juju Watkins and Milaysia Fulwiley 🔥,SLAM HIGH SCHOOL,2022-08-22 18:47:34+00:00,2984430,22287,1383,2022,WNBA,2026-05-30T15:05:39.170655,0.0079
loK1pvuziko,Paige Bueckers hit that 😤,ESPN,2022-11-10 18:58:37+00:00,2428807,73593,444,2022,WNBA,2026-05-30T15:05:39.170655,0.0305
_0y-TNMczzc,FINAL: China vs USA | Full Basketball Game | FIBA Women&#39;s Basketball World Cup 2022,FIBA Basketball,2022-11-21 18:13:32+00:00,2087807,7370,364,2022,WNBA,2026-05-30T15:05:39.170655,0.0037
AhH9ZC8Yvw4,Jordan Clarkson greets Chris Ross &amp; Simon Enciso during halftime of the #PBAFinals Game 1,PBA Official,2022-08-21 12:02:08+00:00,1591236,0,146,2022,WNBA,2026-05-30T15:05:39.170655,0.0001
wJsMtizEgLQ,"TEMPERS FLARE: #1 South Carolina &amp; #17 Maryland SEPARATED, Refs Call Technicals &amp; Intentional Foul",Women Hooping,2022-11-12 16:30:10+00:00,1350772,0,829,2022,WNBA,2026-05-30T15:05:39.170655,0.0006
mQKpU05mX3U,Eight players ejected after punches thrown in TCU-George Washington game | ESPN College Basketball,ESPN,2022-12-07 01:29:15+00:00,1335059,8031,3714,2022,WNBA,2026-05-30T15:05:39.170655,0.0088
D36ovmhUa-4,Caitlin Clark&#39;s RANGE is WILD 🎯,ESPN,2022-12-02 03:29:27+00:00,1320989,37665,816,2022,WNBA,2026-05-30T15:05:39.170655,0.0291
zM4JIcvawHM,That South Carolina connection 🤝 A&#39;ja Wilson &amp; Ja Morant hit the Griddy after Aces&#39; take 2-0 lead,ESPN,2022-09-14 03:20:08+00:00,1298984,35971,369,2022,WNBA,2026-05-30T15:05:39.170655,0.028
R7m1ggMyXS0,"Paige Bueckers SEPARATED After Fighting Over The Ball, Tells Fans To Get Into It! #MarchMadness",Women Hooping,2022-03-22 02:00:13+00:00,1204708,0,673,2022,WNBA,2026-05-30T15:05:39.170655,0.0006
NLM-UXKqv6M,TOP 10 DUNKS FROM WOMEN&#39;S BASKETBALL!!,Courtside Films,2022-08-11 22:00:18+00:00,1072697,6545,1296,2022,WNBA,2026-05-30T15:05:39.170655,0.0073
WBh-FtulDCQ,What Happened to Liz Cambage?,Buckets,2022-08-11 23:56:04+00:00,1007903,18797,1552,2022,WNBA,2026-05-30T15:05:39.170655,0.0202
afDp8rfaHuQ,Coach Kim Mulkey HARASSES Ref ON THE COURT After Not Getting Foul Called In #6 LSU&#39;s Upset LOSS!,Women Hooping,2022-03-05 07:03:37+00:00,914040,0,1314,2022,WNBA,2026-05-30T15:05:39.170655,0.0014
0FTQrSx2-jo,1st Ever Female Alley-oop in High School #shorts,BreakAnklesDaily,2022-03-09 00:53:16+00:00,829289,25689,514,2022,WNBA,2026-05-30T15:05:39.170655,0.0316
a2h4jj4CE1E,"Juhasz GRUESOME Wrist Injury, Leaving Paige Bueckers &amp; ENTIRE UConn Huskies In TEARS During Elite 8!",Women Hooping,2022-03-30 01:30:13+00:00,672472,0,256,2022,WNBA,2026-05-30T15:05:39.170655,0.0004
Sn2jruZtpcM,WORDS EXCHANGED After Cameron Brink SWATS Rickea Jackson&#39;s Shot! | #2 Stanford Cardinal vs Tennessee,Women Hooping,2022-12-19 00:46:07+00:00,625169,0,627,2022,WNBA,2026-05-30T15:05:39.170655,0.001
7Q7lKvgwXfM,Sabrina Ionescu 2022 Full Season Highlights,New York Liberty,2022-10-26 21:17:08+00:00,488394,2730,154,2022,WNBA,2026-05-30T15:05:39.170655,0.0059
UqZNbiPtP_M,Kelsey Plum vs. Sue Bird. Student vs. Teacher 😱,WNBA Got Game,2022-08-31 19:43:52+00:00,470734,8915,248,2022,WNBA,2026-05-30T15:05:39.170655,0.0195
_DC3HY2NkMA,Sadler Taken Off On STRETCHER After Knocked Over By OWN TEAMMATE Accidentally | Pac-12 Tournament,Women Hooping,2022-03-03 00:00:09+00:00,352063,0,159,2022,WNBA,2026-05-30T15:05:39.170655,0.0005
o4QKOScwqOA,Caitlin Clark INJURED On FINAL PLAY In #4 Iowa UPSET LOSS To Unranked Kansas State After Dropping 27,Women Hooping,2022-11-18 04:40:56+00:00,334840,0,160,2022,WNBA,2026-05-30T15:05:39.170655,0.0005
rBsieiD2BKU,"Paige Bueckers, Azzi Fudd Watch In SHOCK As Nika Muhl Takes KNEE To HEAD, Left Game | UConn Huskies",Women Hooping,2022-12-09 03:29:04+00:00,272923,0,121,2022,WNBA,2026-05-30T15:05:39.170655,0.0004
2MvcM2XJ4pY,Han Xu 2022 Full Season Highlights,New York Liberty,2022-12-21 17:00:04+00:00,235296,1056,174,2022,WNBA,2026-05-30T15:05:39.170655,0.0052
kLgAdDsKttg,Retired HC Bill Laimbeer surprises the Aces while celebrating his birthday tonight! 🧸❤️ | #shorts,ESPN,2022-05-20 04:37:42+00:00,163177,4546,343,2022,WNBA,2026-05-30T15:05:39.170655,0.03
FKb2B2bSRps,Sue Bird doing Sue Bird things 🤯,ESPN,2022-08-07 21:09:14+00:00,135351,1796,84,2022,WNBA,2026-05-30T15:05:39.170655,0.0139
h_4qaZfb5uI,这个打爆乔丹的男人在77面前不堪一击😅 ＃东契奇＃莫兰特,篮球人物,2022-09-13 12:34:12+00:00,113454,1972,46,2022,WNBA,2026-05-30T15:05:39.170655,0.0178
sa_gmHUNNjw,Marine Johannès 2022 Full Season Highlights,New York Liberty,2022-12-07 17:00:34+00:00,100608,924,71,2022,WNBA,2026-05-30T15:05:39.170655,0.0099
P9lfZ757Z_I,Candace Parker COOKING the Connecticut Sun! 🔥,TPGC Highlights,2022-09-01 00:56:48+00:00,78862,902,33,2022,WNBA,2026-05-30T15:05:39.170655,0.0119
ZqVp765-C2c,Kelsey Plum highlights: NCAA tournament top plays,March Madness,2022-08-19 16:47:17+00:00,59651,505,48,2022,WNBA,2026-05-30T15:05:39.170655,0.0093
3CAV868AWDs,"Happy birthday, Sylvia Fowles. Age is just a number when you’re dunking in your last All-Star game 😱",WNBA Got Game,2022-10-06 19:39:01+00:00,55326,1207,127,2022,WNBA,2026-05-30T15:05:39.170655,0.0241
guzJH_4vHPo,"LAS VEGAS ACES vs CONNECTICUT SUN | FULL GAME HIGHLIGHTS | September 15, 2022",WNBA,2022-09-16 03:39:52+00:00,53338,698,111,2022,WNBA,2026-05-30T15:05:39.170655,0.0152
2ZVYDpCWS58,A’Ja Wilson Goes Through THREE Defends For the TOUGH Bucket! 😤,TPGC Highlights,2022-09-01 03:02:29+00:00,48152,760,32,2022,WNBA,2026-05-30T15:05:39.170655,0.0164
YOIVZVHh-HA,Kelsey Plum just LAUNCHED IT 😱,GD's Highlights,2023-06-27 17:00:30+00:00,106434906,4063820,19874,2023,WNBA,2026-05-30T15:05:39.170655,0.0384
OFgzgmd2LRQ,Top 15 Viral Social Moments of 2023 🙌 - #2 Sydney Colson and A’ja Wilson Bench Shenanigans!,WNBA,2023-12-30 17:57:08+00:00,12000548,467351,6955,2023,WNBA,2026-05-30T15:05:39.170655,0.0395
47m40z-fLfE,ex USA Women vs Men 0-12 - All Goals &amp; Highlights 2023,Women Football Best Moments,2023-06-21 11:00:02+00:00,8488724,74386,15170,2023,WNBA,2026-05-30T15:05:39.170655,0.0105
aES3r4-pUJg,Caitlin Clark really waved her off 😭,ESPN,2023-04-01 04:41:05+00:00,5370445,114855,4929,2023,WNBA,2026-05-30T15:05:39.170655,0.0223
qB3X76gmyIM,"&quot;The Shot&quot; - Caitlin Clark, 1.5 Seconds - &quot;Wow!&quot; &quot;Holy Smokes!&quot;",Trust The Shooters,2023-08-18 18:00:22+00:00,4525194,156137,4287,2023,WNBA,2026-05-30T15:05:39.170655,0.0355
6uiLkNNS9io,"CHAOS After Player STEPS ON Opponent HEAD After Fouling Her. Ejection, Intentional Fouls, Technicals",Women Hooping,2023-01-29 18:51:52+00:00,3034021,0,3077,2023,WNBA,2026-05-30T15:05:39.170655,0.001
QRB2XePLGdY,Player CHARGED With ASSAULT After PUNCHING Opponent To The Ground In Handshake Line After WNIT Game!,Women Hooping,2023-03-25 01:46:52+00:00,2702827,0,3636,2023,WNBA,2026-05-30T15:05:39.170655,0.0013
ExXjAT709rM,Caitlin Clark - The Shot,king kim,2023-02-27 17:43:14+00:00,2386760,14268,2270,2023,WNBA,2026-05-30T15:05:39.170655,0.0069
LEYGcsONOx4,National Championship: LSU Tigers vs. Iowa Hawkeyes | Full Game Highlights,ESPN,2023-04-02 22:04:02+00:00,2127718,21707,5019,2023,WNBA,2026-05-30T15:05:39.170655,0.0126
IOdj-g0NQ7w,"Caitlin Clark SHOVED DOWN, Back-To-Back INTENTIONAL Fouls By #10 Georgia Closing Out Loss To #2 Iowa",Women Hooping,2023-03-20 23:54:21+00:00,1851748,0,1829,2023,WNBA,2026-05-30T15:05:39.170655,0.001
rDLBFfsC1BI,A’ja Wilson held back by teammates and Becky Hammon after being shoved 👀,WNBA Got Game,2023-08-18 11:08:42+00:00,719426,18138,1475,2023,WNBA,2026-05-30T15:05:39.170655,0.0273
wou5o8WNcrM,2023/02/26 - #6 Iowa vs #2 Indiana - Women&#39;s Basketball -,Antonio Garcia T.,2023-02-27 07:39:02+00:00,597013,4106,0,2023,WNBA,2026-05-30T15:05:39.170655,0.0069
YgdmvCLJZsU,DeWanna Bonner and Dijonai Carrington Getting into it on the Connecticut Sun Bench 👀,TPGC Highlights,2023-09-30 00:26:09+00:00,181983,1669,255,2023,WNBA,2026-05-30T15:05:39.170655,0.0106
k4RhNiFYXn0,Top 15 Viral Social Moments of 2023 🙌 #10 - Sabrina Ionescu calling bank for 3-PT record,WNBA,2023-12-22 15:57:48+00:00,143493,2569,67,2023,WNBA,2026-05-30T15:05:39.170655,0.0184
llYJUKv5UeA,MAYA MOORE THE GREATEST WOMEN’S PLAYER EVER!!,Women’s Basketball 1on1,2023-05-10 15:08:58+00:00,76677,3467,299,2023,WNBA,2026-05-30T15:05:39.170655,0.0491
v4t-t-j6ii8,WHAT A MOVE by Marine Johannès 😮‍💨 #shorts,ESPN,2023-08-29 03:23:35+00:00,67641,2286,77,2023,WNBA,2026-05-30T15:05:39.170655,0.0349
OO18KuG6344,Top 15 Viral Social Moments of 2023 🙌 - #6 The final seconds that secured the Aces’ B2B Chips!,WNBA,2023-12-27 20:59:06+00:00,65721,1582,77,2023,WNBA,2026-05-30T15:05:39.170655,0.0252
PUGcBzWNn_4,The way they held back A’ja Wilson 😅 #shorts,ESPN,2023-08-18 17:46:48+00:00,56215,2150,125,2023,WNBA,2026-05-30T15:05:39.170655,0.0405
Gy1kiShUEMc,Highlight plays from South Carolina freshman guard MiLaysia Fulwiley,WBB Clips,2023-11-06 22:25:01+00:00,52354,1843,66,2023,WNBA,2026-05-30T15:05:39.170655,0.0365
lI1lV9DwbJ4,Awkwardness on display between Chloe Kitts and Collin Murray-Boyles,WBB Clips,2024-02-10 04:28:30+00:00,70768239,1819241,14165,2024,WNBA,2026-05-30T15:05:39.170655,0.0259
WanQZgKVeg4,She Proved Everybody Wrong! 🤯 (@iamcherellegoerge),MediaConquer,2024-03-26 13:08:14+00:00,41451968,1288947,20102,2024,WNBA,2026-05-30T15:05:39.170655,0.0316
9hrl2RgSszg,Angel Reese Was Tellin&#39; Em How It Is! 😅😤💨,Jai Davis On It 🏀,2024-06-24 00:23:22+00:00,18746431,621151,14382,2024,WNBA,2026-05-30T15:05:39.170655,0.0339
k4CTgA1D6so,Angel Reese is jealous of Caitlin Clark 😳 #shorts,Locoprezident,2024-06-16 20:00:54+00:00,12708554,376703,8071,2024,WNBA,2026-05-30T15:05:39.170655,0.0303
UaWW9W_ZmyE,Caitlin Clark is too nice to be means to! #shorts #caitlinclark,HangTime,2024-07-02 19:17:27+00:00,11139218,830794,6491,2024,WNBA,2026-05-30T15:05:39.170655,0.0752
cAFa86ezUmg,Caitlin Clark Grabs Rebound in Final Seconds to Secure Second Career Triple-Double | Indiana Fever,Indiana Fever,2024-09-05 01:03:30+00:00,9623371,171883,2649,2024,WNBA,2026-05-30T15:05:39.170655,0.0181
ZhnAkYwotww,Angel Reese is UGLY to watch 😳,thekickclub,2024-06-20 20:52:11+00:00,8891744,223615,26913,2024,WNBA,2026-05-30T15:05:39.170655,0.0282
J6Qv88irB-g,Angel Reese+ Caitlin Clark Voiceover 😂😂😂 #shorts,hoopology,2024-07-20 00:53:27+00:00,8014762,278203,838,2024,WNBA,2026-05-30T15:05:39.170655,0.0348
GTM6RRH62DA,The Night LaMelo Ball Humbled Julian Newman,Hoop Dungeon,2024-08-06 16:01:46+00:00,4996291,29791,1987,2024,WNBA,2026-05-30T15:05:39.170655,0.0064
5t3F7n-Di9A,Caitlin Clark vs Angel Reese narrative,thekickclub,2024-06-18 14:38:43+00:00,3937057,117986,6516,2024,WNBA,2026-05-30T15:05:39.170655,0.0316
Td5DHjIv8yE,Caitlin Clark high IQ play 😅,ESPN,2024-04-06 05:15:00+00:00,3500395,67659,1501,2024,WNBA,2026-05-30T15:05:39.170655,0.0198
-n-DETjkAFw,"🤕 Poa Leaves ON STRETCHER, Angel Reese &amp; LSU Tigers In TEARS In SEC Tournament Semifinal vs Ole Miss",Women Hooping,2024-03-10 02:24:00+00:00,3015179,0,3006,2024,WNBA,2026-05-30T15:05:39.170655,0.001
HF27pw4ucwk,"Caitlin Clark escorted to locker room by police, fans STORM COURT after #2 Iowa UPSET #shorts #short",Women Hooping,2024-02-11 20:55:19+00:00,2761627,0,3302,2024,WNBA,2026-05-30T15:05:39.170655,0.0012
_GhjtivRUnI,"🥰 Cameron Brink Hugs Caitlin Clark, Lexie Hull After Los Angeles Sparks win vs Indiana Fever #shorts",Women Hooping,2024-05-29 01:34:42+00:00,2569581,0,2804,2024,WNBA,2026-05-30T15:05:39.170655,0.0011
3BjSBiaC3Aw,ex USA Women vs Teenage Boys (Say Word FC) 0-5 - All Goals &amp; Highlights 2023,Women Football Best Moments,2024-08-31 14:30:06+00:00,2420918,13476,4764,2024,WNBA,2026-05-30T15:05:39.170655,0.0075
IkLX94SgIXI,Angel Reese With The MONSTER Slam!,Balled IN,2024-06-13 10:29:43+00:00,2371048,0,8151,2024,WNBA,2026-05-30T15:05:39.170655,0.0034
HaoQjOP1ch0,Angel Reese&#39;s intro is TOUGH 🙌🔥 #shorts,ESPN,2024-03-01 15:45:00+00:00,2177365,77470,2374,2024,WNBA,2026-05-30T15:05:39.170655,0.0367
i_UudxUj7ek,Caitlin Clark took Jacy Sheldon’s ankles 😳,Yahoo! Sports,2024-05-04 00:35:05+00:00,2149871,38770,2171,2024,WNBA,2026-05-30T15:05:39.170655,0.019
TcRGoJEF-Us,Iowa vs. UConn  - 2024 NCAA women’s Final Four | FULL REPLAY,March Madness,2024-04-08 01:45:01+00:00,2008530,15032,925,2024,WNBA,2026-05-30T15:05:39.170655,0.0079
M7wUVsuS3OM,The Angel Reese Quadruple Double Dribble 😳,SportsHog Tv,2024-06-22 04:35:46+00:00,1750787,15143,8145,2024,WNBA,2026-05-30T15:05:39.170655,0.0133
nIAfdY5FYOM,Iowa vs. LSU - 2024 NCAA women&#39;s basketball Elite Eight | FULL REPLAY,March Madness,2024-04-03 23:30:14+00:00,1677594,10058,861,2024,WNBA,2026-05-30T15:05:39.170655,0.0065
loDCUdGhnFw,Caitlin Clark SHUTS UP Angel Reese And BOOING CROWD With CAREER High 🔥,Ace,2024-08-31 21:59:13+00:00,1587556,10065,1667,2024,WNBA,2026-05-30T15:05:39.170655,0.0074
juRbCql8tgs,EVERY MOMENT From Caitlin Clark&#39;s Record Breaking Night | Full Highlights | 2.15.24,Swish,2024-02-16 03:52:13+00:00,1318554,11522,945,2024,WNBA,2026-05-30T15:05:39.170655,0.0095
jM56LBF4--8,ALL STARS AMAZED AT Caitlin Clark’s Pass 🔥 #caitlinclark #basketball #shorts,ESPBEN,2024-12-08 21:01:15+00:00,1231632,37035,1107,2024,WNBA,2026-05-30T15:05:39.170655,0.031
vFu7fcJ0gL8,25 Times Caitlin Clark EMBARRASSED Her Opponents,The Hoop Doctor,2024-08-14 09:03:54+00:00,1190480,7826,649,2024,WNBA,2026-05-30T15:05:39.170655,0.0071
5strycyvfbg,Best of Caitlin Clark: First Half of 2024 Season Highlights,WNBA,2024-08-07 18:39:34+00:00,1156278,7579,1142,2024,WNBA,2026-05-30T15:05:39.170655,0.0075
7q8M_ADaeU4,Caitlin Clark was unstoppable at 7 years old! #shorts #caitlinclark,HangTime,2024-07-03 19:12:12+00:00,1092280,16193,918,2024,WNBA,2026-05-30T15:05:39.170655,0.0157
NjgXnaKB0gc,Angel Reese missed layups but they get increasingly more ridiculous,Hoop Dungeon,2024-07-19 17:49:24+00:00,996613,11567,6492,2024,WNBA,2026-05-30T15:05:39.170655,0.0181
UyfdSWvWvDA,When Sabrina Ionescu’s Broke The  All-Time 3-Point Challenge Record!🤯,NBA,2024-01-30 18:18:40+00:00,907008,8232,981,2024,WNBA,2026-05-30T15:05:39.170655,0.0102
E_sVLtTODRk,"Chicago Sky vs. Indiana Fever | FULL GAME HIGHLIGHTS | June 23, 2024",WNBA,2024-06-23 22:31:54+00:00,883291,8864,2900,2024,WNBA,2026-05-30T15:05:39.170655,0.0133
chJm1ygWPbg,This is without question the best thing I&#39;ve ever seen,DOSE OF INTERNET,2025-10-24 14:38:06+00:00,7907702,49871,634,2025,WNBA,2026-05-30T15:05:39.170655,0.0064
XCEYwSNYEto,Caitlin Clark Gets Her REVENGE!,Coach Clank,2025-06-18 19:37:00+00:00,5970817,101435,4797,2025,WNBA,2026-05-30T15:05:39.170655,0.0178
CdepoiGPT9Q,Don&#39;t DISRESPECT Caitlin Clark 😤🔥,GD's Highlights,2025-06-18 14:00:17+00:00,5901731,131712,3048,2025,WNBA,2026-05-30T15:05:39.170655,0.0228
ykXlMW2_pk0,3 EJECTED after fight as Sophie Cunningham stands up for Caitlin Clark,Chaz NBA,2025-06-18 01:29:45+00:00,5859110,39392,12335,2025,WNBA,2026-05-30T15:05:39.170655,0.0088
7UB-CfIlqVU,Pro Women vs Middle School Prodigies,Jeffrey Bui,2025-08-28 00:06:00+00:00,3077836,55371,9674,2025,WNBA,2026-05-30T15:05:39.170655,0.0211
06bKzb61BPc,Don’t mess with Caitlin Clark 😤,House of Highlights,2025-05-23 01:47:01+00:00,2776621,31382,652,2025,WNBA,2026-05-30T15:05:39.170655,0.0115
5bJOfw1EQxc,The Mighty Mercury are here 🤩,WNBA,2025-10-10 22:31:13+00:00,2753392,52611,2487,2025,WNBA,2026-05-30T15:05:39.170655,0.02
VjlhLoLng8U,Sophie Cunningham stands her Ground! #caitlinclark #basketball #shorts,ESPBEN,2025-09-19 17:13:53+00:00,2721475,41572,3064,2025,WNBA,2026-05-30T15:05:39.170655,0.0164
2OE5bFMgY1c,The Caitlin Clark and Sophie Cunningham Story,Arsyadani,2025-06-13 18:12:01+00:00,2668319,24338,423,2025,WNBA,2026-05-30T15:05:39.170655,0.0093
zUp7ZzGV7hs,The Aces aim to go up 2-0,WNBA,2025-10-05 17:29:00+00:00,2652975,43605,1679,2025,WNBA,2026-05-30T15:05:39.170655,0.0171
WsawBxG9jAM,High School Girls vs Middle School Prodigies,Jeffrey Bui,2025-06-23 23:00:39+00:00,2605542,21547,2241,2025,WNBA,2026-05-30T15:05:39.170655,0.0091
7kReekjHWw4,Angel Reese holding back her HC 😦,Bleacher Report,2025-08-23 22:22:57+00:00,2533584,70972,3737,2025,WNBA,2026-05-30T15:05:39.170655,0.0295
UoAP_L3Ao20,Caitlin Clark PUTS ON A SHOW in Return to Lead Fever to Huge Win Over Liberty | FULL Game Highlights,Indiana Fever,2025-06-14 21:54:47+00:00,2024860,17584,3527,2025,WNBA,2026-05-30T15:05:39.170655,0.0104
dpKIR555aOw,"Angel Reese Fouls, Dribbles High Then… #caitlinclark #basketball #shorts",ESPBEN,2025-02-28 15:27:33+00:00,1899301,25663,6445,2025,WNBA,2026-05-30T15:05:39.170655,0.0169
nY-EhFGFvy4,Indiana Fever Put on a SHOW in 35-Point Opening Day Win Over Chicago Sky | FULL Game Highlights,Indiana Fever,2025-05-17 22:15:47+00:00,1620227,18170,4933,2025,WNBA,2026-05-30T15:05:39.170655,0.0143
ZuOO6Q3RM5g,Caitlin Clark DESTROYED Angel Reese With a TRIPLE DOUBLE In First Game of Second Season🔥,Ace,2025-05-18 14:34:17+00:00,1142197,6229,578,2025,WNBA,2026-05-30T15:05:39.170655,0.006
zRc2lguXROk,Caitlin Clark hits 3 straight crazy threes in 38 seconds vs New York 😳,Chaz NBA,2025-06-14 21:28:43+00:00,940876,11477,2386,2025,WNBA,2026-05-30T15:05:39.170655,0.0147
kSA91GkQh9U,Caitlin Clark&#39;s DEEPEST Shots of Her Career!,Hoop Legends,2025-03-20 21:00:40+00:00,883665,8064,650,2025,WNBA,2026-05-30T15:05:39.170655,0.0099
uc0mOjZ7FHM,New York Doctor Spots Cancer on Woman During HGTV Appearance,Inside Edition,2018-06-05 21:56:35+00:00,37463880,573108,16770,2018,PWHL,2026-05-30T15:05:39.170655,0.0157
tIfXsxtnGr4,Why women’s ice hockey has a higher concussion rate than football,Vox,2018-02-14 13:00:05+00:00,1135107,20727,2278,2018,PWHL,2026-05-30T15:05:39.170655,0.0203
